,Link,Alternative_for,Name,Description
37,https://www.predictiveanalyticstoday.com/databox/,SAP Crystal Dashboard Design,Databox,"[""Business Analytics platform built to help you understand what's going on with your business. KPIs from cloud services, spreadsheets, database in one place. From a morning briefing that makes sure you start the day knowing where you stand and how you’re progressing towards your goals, to smart alerts throughout the week that let you know when something needs your attention, Databox makes sure you’re never in the dark about the data that matters most to you."", 'The Databox mobile app provides data access and business insights through an intuitive mobile experience. Through an actionable, personalized experience that enables collaboration, Databox helps users stay on top of their business anytime, anywhere. For Marketers it helps create real-time reports for clients and have all performance KPIs in one place. For executives it is useful as it stops them struggling with Excel files or outdated PDF reports. They are able to compile all the KPIs in their pocket.', 'For analysts Databox helps deliver key Business Insights to their leadership teams on mobiles, in minutes, not days. With Databox, users have key business metrics at their fingertips. Beautifully designed mobile apps make staying in the loop a breeze. With Databox users can make sure their team knows what’s important and they can get everyone focused on the metrics that matter. In an office, in the hall, or in meetings.', 'All the data is in one place. Users can choose from dozens of pre-built integrations or use Databox API and SDKs to easily aggregate data from all of their data sources. Databox allows set up in minutes. All the user needs to do is connect. Hook up multiple data sources. Customize. Select key metrics from each. Access. View all KPIs everywhere. Databox is very helpful is creating beautiful reports.', 'No coding required. With the Databox Designer it’s easy to build personalized reports for web or mobile in just minutes. Powerful, yet simple. Its drag and drop editor makes it easy to pull together exactly the information the user needs. Customizing views by adding metrics or changing visualizations at any time is easy as a breeze. Users can spice up their Slack communication with data that matters. Seamless data access, wherever they go.', 'You may like to read: Open Source, Free and Top Dashboard Software and How to Select the Best Dashboard Software for Your Business']"
38,https://www.predictiveanalyticstoday.com/qlikview-personal-edition/,SAP Crystal Dashboard Design,QlikView Personal  Edition,"['QlikView, is the leading Business Discovery Platform, providing user driven business intelligence (BI) to a variety of organizations worldwide. QlikView makes data associative, creating easily-understandable visual relationships across multiple, complex data sources. It’s also mobile, social and collaborative. QlikView Personal Edition is the full QlikView Desktop product that is run on a machine without a customer or partner license assigned to it. With the QlikView Personal Edition license, everyone is free to create QlikView documents for personal use. If at any point you or your organization decides to acquire a full QlikView license, this Personal Edition installation will automatically become a full QlikView client without requiring any additional software.', 'Features include consolidating relevant data from multiple sources into a single application, exploring the associations in data, enabling social decision making through secure, real-time collaboration.', 'Visualizing data with engaging, state-of-the-art graphics, searching across all data—directly and indirectly, interacting with dynamic apps, dashboards and analytics and accessing, analyzing and capturing data from mobile devices .', 'Qlik is a leader in data discovery delivering intuitive solutions for self-service data visualization and guided analytics. Approximately 34,000 customers rely on Qlik solutions to gain meaning out of information from varied sources, exploring the hidden relationships within data that lead to insights that ignite good ideas. Headquartered in Radnor, Pennsylvania, Qlik has offices around the world with more than 1700 partners covering more than 100 countries.']"
39,https://www.predictiveanalyticstoday.com/google-data-studio/,SAP BusinessObjects BI,Google Data Studio,"['Google Data Studio provides easy access to all the data sources for the business to make better decisions. Regardless of whether you’re a business user or a data analyst, and no matter where the data lives, simply access it with a pre-built Data Studio connector.', 'Data Studio handles the authentication, access rights, and structuring of the data. Once a data source is connected, the underlying dimensions and metrics are readily available for use in calculations, transformations, and visualizations.', 'With Data Studio you’ll be able to transform your raw data into the metrics and dimensions needed to create easy-to-follow reports and dashboards. Simple solutions help you cleanse, combine, and transform all your data without writing code or creating SQL queries.', 'Data Studio allows you to leverage the collective wisdom of your entire team with built-in collaboration. Individuals and teams can easily edit, view, add comments, and manage versions of dashboards and reports — both within and outside the walls of your company.', 'No more spreadsheets and emails going back and forth, and no more worrying about managing versions.']"
40,https://www.predictiveanalyticstoday.com/cyfe/,SAP BusinessObjects BI,Cyfe,"['Cyfe, is a self-service cloud based business intelligence dashboard app, designed to analyze, transform and report data from different integrated sources of business intelligence. It is a freemium application to track and monitor all business metrics in one single place.', 'Cyfe Dashboard is an online dashboard platform for building real-time business dashboard.Cyfe provides a browser-based dashboard that allows business users to connect to many data services, automate data retrieval, analyze, and then transform and visualize the data for business intelligence. The product targeted non-technical end user by providing them a schema-less architecture to easily connect to data sources, and separates data from presentation and reuse data sources throughout the platform.', 'Cyfe Premium provides customized features and functions that can be used to edit built-in formula, to transform, integrate, and filter any data before visualizing in the front end dashboard.', 'You may like to read: Open Source, Free and Top Dashboard Software and How to Select the Best Dashboard Software for Your Business']"
41,https://www.predictiveanalyticstoday.com/cluvio/,SAP BusinessObjects BI,Cluvio,"['Cluvio is a cloud analytics platform for startups and data-driven teams, trusted by over 100 companies. Users can use SQL and R to analyze their data and in a few minutes create beautiful, interactive dashboards for their entire company.', 'There is a wealth of information hiding in the data in the users’ database that is just waiting to be discovered. Daily active users, monthly recurring revenue, signups per day. With Cluvio, users can see the most important KPIs on interactive, real-time dashboards anywhere, anytime.', 'Users can receive alerts for conditions that users define - a sudden drop in number of orders, increased error rates or revenue goals that were reached. Defining and exposing reality based on actual data makes everyone in the company more curious and engaged in the success.', 'Cluvio is very easy to get started with and grows with users’ team. Cluvio is completely free for single users. Users can write SQL, get charts and share dashboards. It doesn’t get easier than this. Cluvio dashboards looks amazing.', 'Cluvio’s usability can’t be measured by normal standards. It is great. Dashboards in Cluvio can be easily made interactive with time based and custom filters. The combined expressiveness of SQL and R makes the Cluvio analysis pipeline extremely powerful.', 'Users can get automatic suggestions for SQL queries and intelligent chart recommendations. Cluvio was designed with pricing that suits any sizes of companies, even cash-strapped startups. With Cluvio pro and business plans, users can invite an unlimited number of business users for free.']"
42,https://www.predictiveanalyticstoday.com/databox/,SAP BusinessObjects BI,Databox,"[""Business Analytics platform built to help you understand what's going on with your business. KPIs from cloud services, spreadsheets, database in one place. From a morning briefing that makes sure you start the day knowing where you stand and how you’re progressing towards your goals, to smart alerts throughout the week that let you know when something needs your attention, Databox makes sure you’re never in the dark about the data that matters most to you."", 'The Databox mobile app provides data access and business insights through an intuitive mobile experience. Through an actionable, personalized experience that enables collaboration, Databox helps users stay on top of their business anytime, anywhere. For Marketers it helps create real-time reports for clients and have all performance KPIs in one place. For executives it is useful as it stops them struggling with Excel files or outdated PDF reports. They are able to compile all the KPIs in their pocket.', 'For analysts Databox helps deliver key Business Insights to their leadership teams on mobiles, in minutes, not days. With Databox, users have key business metrics at their fingertips. Beautifully designed mobile apps make staying in the loop a breeze. With Databox users can make sure their team knows what’s important and they can get everyone focused on the metrics that matter. In an office, in the hall, or in meetings.', 'All the data is in one place. Users can choose from dozens of pre-built integrations or use Databox API and SDKs to easily aggregate data from all of their data sources. Databox allows set up in minutes. All the user needs to do is connect. Hook up multiple data sources. Customize. Select key metrics from each. Access. View all KPIs everywhere. Databox is very helpful is creating beautiful reports.', 'No coding required. With the Databox Designer it’s easy to build personalized reports for web or mobile in just minutes. Powerful, yet simple. Its drag and drop editor makes it easy to pull together exactly the information the user needs. Customizing views by adding metrics or changing visualizations at any time is easy as a breeze. Users can spice up their Slack communication with data that matters. Seamless data access, wherever they go.', 'You may like to read: Open Source, Free and Top Dashboard Software and How to Select the Best Dashboard Software for Your Business']"
43,https://www.predictiveanalyticstoday.com/qlikview-personal-edition/,SAP BusinessObjects BI,QlikView Personal  Edition,"['QlikView, is the leading Business Discovery Platform, providing user driven business intelligence (BI) to a variety of organizations worldwide. QlikView makes data associative, creating easily-understandable visual relationships across multiple, complex data sources. It’s also mobile, social and collaborative. QlikView Personal Edition is the full QlikView Desktop product that is run on a machine without a customer or partner license assigned to it. With the QlikView Personal Edition license, everyone is free to create QlikView documents for personal use. If at any point you or your organization decides to acquire a full QlikView license, this Personal Edition installation will automatically become a full QlikView client without requiring any additional software.', 'Features include consolidating relevant data from multiple sources into a single application, exploring the associations in data, enabling social decision making through secure, real-time collaboration.', 'Visualizing data with engaging, state-of-the-art graphics, searching across all data—directly and indirectly, interacting with dynamic apps, dashboards and analytics and accessing, analyzing and capturing data from mobile devices .', 'Qlik is a leader in data discovery delivering intuitive solutions for self-service data visualization and guided analytics. Approximately 34,000 customers rely on Qlik solutions to gain meaning out of information from varied sources, exploring the hidden relationships within data that lead to insights that ignite good ideas. Headquartered in Radnor, Pennsylvania, Qlik has offices around the world with more than 1700 partners covering more than 100 countries.']"
44,https://www.predictiveanalyticstoday.com/ataccama/,SAP Master Data Governance,Ataccama,"['Master Data Center (MDC) is part of the complete Ataccama family of products, providing functionality together with ease of use, broad compatibility, and the ability to customize the solution to meet users specific business needs.MDC is a platform optimized for demanding transactional environments that makes consistent, accurate, and up-to-date data instantly available across a wide range of internal systems and enterprise applications.', 'MDC is fast, reliable, and designed to integrate with user’s existing infrastructure. Its advanced architecture and high-performance engine are designed for demanding real-time and near-real-time environments, where large number of records must be handled. It can instantly provide the accurate, integrated data to a wide variety of enterprise applications, such as CRM, analytical applications, or self-care systems.', 'MDC serves as the core platform for customer processes and client segmentation.It enables creation of unique data utilized in data mining models such as risks, trend predictions, irregularity detection, future value, and more.', 'MDC ships with pre-built vertical business models optimized for Product, Contact, and Customer business domains. Business processes can directly leverage deployment-ready master data management services, ranging from simple customer management to customer profile search, including unification with additional business entities.MDC uses parallel data processing methods to ensure scalability, and is designed to handle large data volumes in both online and batch processing modes. MDC is created to work seamlessly with existing systems, both external and internal, without requiring additional external tools or third party applications. It is supplied with a number of interface modules for simple integration into users existing infrastructure.', 'You may like to read: Top Master Data Management Software and How to Select the Best Master Data Management Software for Your Business']"
45,https://www.predictiveanalyticstoday.com/profisee/,SAP Master Data Governance,Profisee,"['Profisee Platform is a full featured enterprise master data management solution designed to provide the lowest total cost of ownership of any competitive solution, without sacrificing on functionality across all major components of an MDM platform.', 'The Profisee Platform was designed from the ground up as a multi-domain MDM platform, to model and manage virtually any master data domain or reference data set. With a focus on the business, Profisee provides the first MDM solution that is truly approachable and affordable for business data stewards. The Core Platform delivers the fundamental capabilities needed for every MDM solution.', 'From modeling, data integration to data stewardship and governance, Core Platform provides a single consistent foundation upon which the rest of the Profisee Platform is built.', 'From day one, Core Platform was envisioned and built to provide a truly multi-domain platform for Master Data Management. Whether you’re a system administrator configuring a solution, or a business data steward managing data, our multi-domain platform for MDM provides a single consistent user experience across the entire Profisee Platform. Every domain, every user, every record, every source, one Core Platform.']"
46,https://www.predictiveanalyticstoday.com/talend-master-data-management/,SAP Master Data Governance,Talend Master Data Management,"['Talend Master Data Management (MDM) unifies any amount of data--from customers to products to suppliers and beyond--into an individual, actionable ""version of the facts. "" As part of the Talend Info Fabric, Talend MDM combines real-time data, applications, and process integration with inlayed data quality and stewardship to share across on-premises, cloud and mobile applications.', ""Plan and drive their MDM journey across multiple domains, lines of businesses, integration scenarios and delivery in the cloud or on-premises. Empower decision producers to create and promote a trusted golden record across internal and exterior sources that have built-in data integration, data quality, stewardship, and self-service data prep, by serving crucial data to both applications and other business processes in real time, Talend MDM turns expert data into insight and actions. Connect and allow Big Data, mobile, cloud or on-premises applications with master data at the pace of change to one's business."", ""Talend MDM provides an intuitive and effective approach for developing and rolling out expert data initiatives with a unified platform so one can start small and expand quickly. Deliver on the promise of MDM faster, and expand the scope and reach incrementally. Talend MDM lowers the total expense of ownership so one can your return on investment faster. A predictable, pay-as-you-go membership lets one get began instantly without an advanced budgeting or confusing every domain, per record, every connectors pricing. A one platform with graphical tools and native code era maximizes team's productivity so they can shift easily between integration styles.""]"
47,https://www.predictiveanalyticstoday.com/orchestra-networks/,SAP Master Data Governance,Orchestra Networks,"['EBX5 is a way to manage, govern and share the data assets. EBX5 uses a unique model that eliminates the need for long, costly, and endless development projects. EBX5 includes all the enterprise-class capabilities needed for creating data-driven applications: data stewardship, workflow, data quality and data integration, all built right in.', 'EBX5 usees a model-driven approach to design data management applications. Users can configure only the features they need. Model-driven design simplifies change management. Updates do not require coding, just configuration changes.EBX5 provides enterprise-class integration capabilities to connect the data management application to any operational or analytical systems. With EBX5, users can consolidate and distribute data to a wide range of applications or integrate with their existing middleware infrastructure.', 'EBX5 delivers an intuitive, self-service experience to the business teams. With features like: Consolidation with cleansing and matching, Data Quality dashboards. Remediation and approval workflows and Track changes on data, business users can search, view, edit, author and approve changes in a workflow-driven, collaborative user interface. With EBX5, data stewards have access to sophisticated capabilities for governance, profiling, matching, cleansing, data quality analytics, workflow monitoring and audit trail.', 'They can discern the quality of their data and take action. Developers have full control over data models, workflow models, business rules, UI configuration and data services. They can adapt an application on the fly, without long and costly development projects.EBX5’s platform delivers the flexibility and scalability users need to manage all of their data assets using features such as: Updating a data model, Designing complex relationships, Validation controls and Complex business rules.']"
48,https://www.predictiveanalyticstoday.com/sas-master-data-management/,SAP Master Data Governance,SAS Master Data Management,"['SAS Master Data Management helps you get up and running in a matter of months while working with your existing technology. It’s efficiency at its best.Access big data and traditional sources. Gain access to, integrate and publish data to sources that are more like Hadoop (via Apache Hive) and Impala, in addition to many traditional relational database engines.', 'Data quality over the complete data life cycle - Use integrated features for data gain access to, profiling, address verification, data enrichment, transformation, cross-field enterprise matching and business secret monitoring. Create more important relationships - Create and visualize relationships with custom attributes and multi-domain hierarchies.Easily monitor your data – and view, edit and share information about the status and health of your MDM hub. Source system harmonization.', 'Gain more control over how data is prepared, managed, loaded and synchronized with the source system dashboard and tools. Access role-based MDM interfaces from a common location. Data stewards can track critical data quality issues. Administrators can create new entities or monitor MDM source load processes. Business users can search entities or view and resolve pending remediation issues and reports.Improved governance and lineage. Explore metadata relationships with the lineage visualization tool, and maintain business term consistency with the business glossary.']"
49,https://www.predictiveanalyticstoday.com/sap-business-one/,SAP S/4 HANA,SAP Business One,"['SAP Business One Cloud is cloud-based ERP at its best – making it easier and more affordable to manage all your critical business processes. SAP Business One, version for SAP HANA delivers the integrated financial, CRM, and supply chain features you’d expect in an ERP application – supercharged with in-memory technology.', 'SAP Business One analytics powered by SAP HANA helps you drive informed decision making across your company with affordable analytics fueled by our market-leading in-memory platform, SAP HANA.', 'The ERP software offer solutions ranging from accounting to customer relations management. The key features of SAP Business One are accounting management, financial management, customer relationship management, warehouse and production management,purchasing and procurement, reporting, analysis and integration. SAP Business One can be customized to be industry specific to fit the needs of an entity.', 'The system manages consumer products by improving loyalty to customers through customer relationship management, forecasting, inventory control and supplier support and integration. With SAP Business One, one can shrink the supply chain costs, increase the time cycles, minimise wastage and re-work. Production planning and control is enhanced, inventory management and order information. SAP Business One supports professional services especially for consulting firms.', 'Service delivery is enhanced through project planning, resource planning among others. Human resource management which includes recruiting workforce is possible through SAP Business One. SAP Business One supports retail services in delivering personalized shopping experienced to customers. Point of Sale (POS) is activated and offer customers a real-time shopping experience. SAP Business One also features wholesale distribution which ensures timely ordering and processing of orders and invetory.', 'The accounting and financial management functionality enables integration of accounting, sales and purchasing,improving margins and profitability. Customer satisfaction and revenue maximization is enhanced through customer relationship management in SAP Business One. Its support sales and marketing campaigns. The software also helps track inventory movement and improve inventory optimization and minimize stock-outs.', 'SAP Business One utilises Intuitive Business Intelligence (BI) to answer queries, give analysis and reports. SAP HANA is one of the versions of SAP Business One which unlocks valuable business insights making decision making easier. Partners ,subsidiaries can be integrated together and comply with the laws and regulations in which the business operates. One can get a licence for SAP Business One and pay for the number of users required.']"
