,Link,Alternative_for,Name,Description
23,https://www.predictiveanalyticstoday.com/descartes-transportation-management-solution/,SAP TMS,Descartes TMS,"['Descartes’ next generation transportation management solutions are swift to implement, easy-to-use and maintain, deliver high value, and support Inter-enterprise Corporation between shippers and carriers. The platform is unique because of its broad capabilities to best manage the flow of freight with unmatched connectivity to hundreds of transportation providers, built-in mode specific functionality, integrated private fleet/for hire transportation management, seamless integration with cross-border customs compliance, and much more. Regardless of whether the supply chain is international or domestic, effectively managing the purchased transportation process to reduce difficulty, improve control, and reduce costs is essential.', 'The platform is unique because of its broad capabilities to best manage the flow of freight with unmatched connectivity to thousands of transportation providers, built-in mode specific functionality, integrated private fleet/for hire transportation management, seamless integration with cross-border customs compliance,', 'Descartes’ Transportation Management suite addresses special requirements across truck, air, ocean or parcel modes with a modular architecture that can be implemented quickly as a whole, or only in the select areas where the greatest help now. Additionally, the Descartes Global Logistics Network. Rapid time-to-value with pre-existing network connections to trading partners and much more.', 'Descartes offers solid optimized planning, consolidation and tendering capabilities based upon over 25 years of proven experience. Descartes has used this expertise to develop our proprietary multi-stop, aggregation, and pooling optimization functionality to help the costumers determine the right consolidation options to reduce freight spend while meeting service requirements.', 'The fast and efficient planning algorithms in the software take minutes, not hours, to run, keeping your logistics operations focused on keeping the warehouse picking and the freight moving. Using a settings-based approach, optimization and consolidation configuration are straightforward to understand and adjust. In addition, because of its integration to the Descartes Global Logistics Network, the connectivity to carriers and trading partners required to electronically execute shipments can be readily available through existing network connections.']"
24,https://www.predictiveanalyticstoday.com/autodesk-vault/,SAP PLM,Autodesk Vault,"['Vault data management software helps designers and engineers organize design data, manage documentation, and track revisions and other development processes. Vault data management software offers features such as shared views, direct CAD integration, data reuse, concurrent design, easy administration and configuration, and Microsoft Office integration.', 'It also offers multisite scalability, stronger data security, fast data searching, enterprise PDM for design & manufacturing, visual data management for inventor, automated engineering change orders, revision control, BOM management, factory design utilities integration, projects and reporting, custom objects, data standardization, vault for infrastructure, integration with civil 3D, single source for project data, versioning, collaborative concurrent design, document management for non-CAD users, vault office web client and vault office thick client.', 'Vault product data management (PDM) software helps users create better designs, reduce errors, build a more efficient development cycle, track revisions and manage the release process. Vault data management software lets users share 2D or 3D views of the user’s work with others, and get comments and feedback directly inside the user’s product. Vault offers integration with Autodesk design and visualization software. Users can also easily configure the files the users want to replace, reuse, or copy to use in new designs.', 'Vault data management software lets multiple team members make concurrent designs from one central location with safe simultaneous access to data. Vault data management software also lets users easily incorporate project data from Vault into Microsoft Office documents, spreadsheets, and presentations. Vault data management software also makes it possible for users to connect workgroups across the globe with a scalable, cost-effective product data management solution.']"
25,https://www.predictiveanalyticstoday.com/autodesk-fusion-lifecycle-plm/,SAP PLM,Autodesk Fusion Lifecycle PLM,"['Autodesk Fusion Lifecycle PLM helps users accelerate product development processes across all departments and locations by automating workflows, key tasks and delivering timely information. In addition Fusion Lifecycle is on the cloud so everyone has access to the data they need anytime, anywhere.', 'Autodesk Fusion Lifecycle PLM offers features such as new product introduction (NPI), Bill of materials, change management, quality management and supplier collaboration. Autodesk Fusion Lifecycle PLM can help define and automate processes to keep the work flowing and your product development on track. Autodesk Fusion Lifecycle PLM delivers a modern change management tool that tracks and records changes to your product designs as they happen.', 'Autodesk Fusion Lifecycle PLM provides real-time access to the product data you need and presents it in graphical dashboards for quick interpretation. Autodesk Fusion Lifecycle PLM offers new product introduction (NPI) tools which help users get the latest product innovations to market on time and on budget. Autodesk Fusion Lifecycle PLM lets users configure and manage structured Bills of Materials (BOMs) and items in a centralized system that is both powerful and easy-to-use while also comparing different BOMs and/or versions of the same BOM interactively.', 'Autodesk Fusion Lifecycle PLM fully defines, reviews, approves and implements product changes in a collaborative environment. Autodesk Fusion Lifecycle PLM also easily configures workflows to provide a clear view of the details the users need to approve Engineering Change Requests (ECR) and Engineering Change Orders (ECO). Autodesk Fusion Lifecycle PLM also lets stakeholders quickly and easily approve suppliers and vendors, manage supplier audits and supplier corrective actions.']"
26,https://www.predictiveanalyticstoday.com/ptc-windchill/,SAP PLM,PTC Windchill,"['PTC Windchill is comprehensive product lifecycle management software that helps the companies of all sizes in the seamless management of their product development. It is a compact package that provides manufacturers with all the necessary tools for the transfer, distribution, visualization, and publishing of the product data.', 'The internet-based design of Windchill allows companies to coordinate and operate from multiple locations. This helps the business leaders and the company managers to manage the complete product lifecycle and associated services from remote locations. Companies from a multitude of industry domains, especially the manufacturing industry, use Windchill to streamline their product development processes.', 'Users find the interface more personalized and customizable. The users can configure the interface and select their own modules or tools which they frequently use, to appear on the interface. Along with the better user experience, Windchill provides in-depth product-related data such as technical product information, CAD models, documents, calculated product specifications and illustrations to help manufacturers dig more into authentic sources of information with ease.', 'Moreover, the inbuilt search algorithm of Windchill ensures that the users get the required information without much hassle. Windchill offers breakthrough Product Lifecycle Management (PLM) capabilities, unleashing more data to more stakeholders throughout the organization through a single source of truth for product data and processes.', ""With it, the organization will improve product quality by connecting teams directly to live operational data. Users’ also reduce IT burden and overhead while ensuring accessibility and security with both on-premise and cloud deployment options. Windchill is a true end-to-end PLM platform that is IoT-ready. With IoT platform integration and a 'Closed-Loop Lifecycle Management', PTC has built cutting-edge, industry-leading technologies to cater to the PLM needs of its customers.""]"
27,https://www.predictiveanalyticstoday.com/siemens-teamcenter/,SAP PLM,Siemens PLM,"['Teamcenter PLM helps users deliver increasingly complex products to market while maximizing productivity and streamlining global operations. Teamcenter PLM features design & simulation management, document & content management, BOM management and PLM process execution. Teamcenter PLM provides cross-domain product design and simulation management through integrations with the MCAD, ECAD, software development, and simulation tools and processes the user’s design team’s use every day.', 'Users can manage, find, share and re-use multi-domain data across geographically distributed design centers through a single, secure source of product design and simulation data. Users can understand the complex relationships and dependencies between requirements and all the subsystems and design domains across all the possible configurations of the product, even as changes are introduced.', 'Users can also create assemblies from parts generated by multiple suppliers that involve complex interactions of subsystems, then prepare and validate the readiness of the design and bill of materials for fabrication, assembly and test.', 'Teamcenter offers a document and content management solutions to manage documents and technical publications in the same product lifecycle management (PLM) system as all the user’s other product-related information. The user’s authors have direct access to product information as the products evolve, and can work to the same milestones. Users can keep the user’s product design and documentation aligned with product changes to reduce the time and cost of documentation while improving quality and delivery.', 'Teamcenter helps users know the product by providing a common source of BOM information across the organization whether basic BOM management, or more advanced BOM management and BOM configuration with greater flexibility and scalability.']"
28,https://www.predictiveanalyticstoday.com/bamboo-rose/,SAP PLM,Bamboo Rose,"['Bamboo Rose is the only digital B2B marketplace powered by proven trade engines, so the users & community can collaboratively discover, develop, and deliver ideas and products to diverse markets around the world. Bamboo Rose helps the user to work more like the consumers shop.', 'The user can easily find and share inspiration, develop big ideas with their buyers and suppliers, and socially manage their entire sourcing and buying community wherever they are across the globe. Bamboo Rose helps users to use their valuable time to do more of the things that really matter. From defining and managing materials, collaborating with and choosing suppliers, to simply seeing all their multi-market implications at a glance.', 'Bamboo Rose helps the user to keep everyone on the same page without all the emails, phone calls and hassles that usually entails, setting up shared work-in-progress calendars, and getting auto alerts on everything from order status to product development milestones. Bamboo Rose is the leading product innovation platform connecting the retail community to discover, develop and deliver products at consumer speed.', ""Providing an intuitive web-based PLM platform, Bamboo Rose simplifies product creation and delivery processes. Bamboo Rose knows that to compete in today's digital economy, retailers need to create successful products and get them to market @ consumer speed all while leveraging a complex global supply chain."", 'As the provider of the leading product innovation platform, Bamboo Rose connects the retail community to discover, develop, and deliver products @ consumer speed. That means users get products to the right market at the right price at the right time. Providing an intuitive web-based PLM platform, Bamboo Rose simplifies product creation and delivery processes.']"
29,https://www.predictiveanalyticstoday.com/google-data-studio/,SAP Lumira,Google Data Studio,"['Google Data Studio provides easy access to all the data sources for the business to make better decisions. Regardless of whether you’re a business user or a data analyst, and no matter where the data lives, simply access it with a pre-built Data Studio connector.', 'Data Studio handles the authentication, access rights, and structuring of the data. Once a data source is connected, the underlying dimensions and metrics are readily available for use in calculations, transformations, and visualizations.', 'With Data Studio you’ll be able to transform your raw data into the metrics and dimensions needed to create easy-to-follow reports and dashboards. Simple solutions help you cleanse, combine, and transform all your data without writing code or creating SQL queries.', 'Data Studio allows you to leverage the collective wisdom of your entire team with built-in collaboration. Individuals and teams can easily edit, view, add comments, and manage versions of dashboards and reports — both within and outside the walls of your company.', 'No more spreadsheets and emails going back and forth, and no more worrying about managing versions.']"
30,https://www.predictiveanalyticstoday.com/cyfe/,SAP Lumira,Cyfe,"['Cyfe, is a self-service cloud based business intelligence dashboard app, designed to analyze, transform and report data from different integrated sources of business intelligence. It is a freemium application to track and monitor all business metrics in one single place.', 'Cyfe Dashboard is an online dashboard platform for building real-time business dashboard.Cyfe provides a browser-based dashboard that allows business users to connect to many data services, automate data retrieval, analyze, and then transform and visualize the data for business intelligence. The product targeted non-technical end user by providing them a schema-less architecture to easily connect to data sources, and separates data from presentation and reuse data sources throughout the platform.', 'Cyfe Premium provides customized features and functions that can be used to edit built-in formula, to transform, integrate, and filter any data before visualizing in the front end dashboard.', 'You may like to read: Open Source, Free and Top Dashboard Software and How to Select the Best Dashboard Software for Your Business']"
31,https://www.predictiveanalyticstoday.com/cluvio/,SAP Lumira,Cluvio,"['Cluvio is a cloud analytics platform for startups and data-driven teams, trusted by over 100 companies. Users can use SQL and R to analyze their data and in a few minutes create beautiful, interactive dashboards for their entire company.', 'There is a wealth of information hiding in the data in the users’ database that is just waiting to be discovered. Daily active users, monthly recurring revenue, signups per day. With Cluvio, users can see the most important KPIs on interactive, real-time dashboards anywhere, anytime.', 'Users can receive alerts for conditions that users define - a sudden drop in number of orders, increased error rates or revenue goals that were reached. Defining and exposing reality based on actual data makes everyone in the company more curious and engaged in the success.', 'Cluvio is very easy to get started with and grows with users’ team. Cluvio is completely free for single users. Users can write SQL, get charts and share dashboards. It doesn’t get easier than this. Cluvio dashboards looks amazing.', 'Cluvio’s usability can’t be measured by normal standards. It is great. Dashboards in Cluvio can be easily made interactive with time based and custom filters. The combined expressiveness of SQL and R makes the Cluvio analysis pipeline extremely powerful.', 'Users can get automatic suggestions for SQL queries and intelligent chart recommendations. Cluvio was designed with pricing that suits any sizes of companies, even cash-strapped startups. With Cluvio pro and business plans, users can invite an unlimited number of business users for free.']"
32,https://www.predictiveanalyticstoday.com/databox/,SAP Lumira,Databox,"[""Business Analytics platform built to help you understand what's going on with your business. KPIs from cloud services, spreadsheets, database in one place. From a morning briefing that makes sure you start the day knowing where you stand and how you’re progressing towards your goals, to smart alerts throughout the week that let you know when something needs your attention, Databox makes sure you’re never in the dark about the data that matters most to you."", 'The Databox mobile app provides data access and business insights through an intuitive mobile experience. Through an actionable, personalized experience that enables collaboration, Databox helps users stay on top of their business anytime, anywhere. For Marketers it helps create real-time reports for clients and have all performance KPIs in one place. For executives it is useful as it stops them struggling with Excel files or outdated PDF reports. They are able to compile all the KPIs in their pocket.', 'For analysts Databox helps deliver key Business Insights to their leadership teams on mobiles, in minutes, not days. With Databox, users have key business metrics at their fingertips. Beautifully designed mobile apps make staying in the loop a breeze. With Databox users can make sure their team knows what’s important and they can get everyone focused on the metrics that matter. In an office, in the hall, or in meetings.', 'All the data is in one place. Users can choose from dozens of pre-built integrations or use Databox API and SDKs to easily aggregate data from all of their data sources. Databox allows set up in minutes. All the user needs to do is connect. Hook up multiple data sources. Customize. Select key metrics from each. Access. View all KPIs everywhere. Databox is very helpful is creating beautiful reports.', 'No coding required. With the Databox Designer it’s easy to build personalized reports for web or mobile in just minutes. Powerful, yet simple. Its drag and drop editor makes it easy to pull together exactly the information the user needs. Customizing views by adding metrics or changing visualizations at any time is easy as a breeze. Users can spice up their Slack communication with data that matters. Seamless data access, wherever they go.', 'You may like to read: Open Source, Free and Top Dashboard Software and How to Select the Best Dashboard Software for Your Business']"
33,https://www.predictiveanalyticstoday.com/qlikview-personal-edition/,SAP Lumira,QlikView Personal  Edition,"['QlikView, is the leading Business Discovery Platform, providing user driven business intelligence (BI) to a variety of organizations worldwide. QlikView makes data associative, creating easily-understandable visual relationships across multiple, complex data sources. It’s also mobile, social and collaborative. QlikView Personal Edition is the full QlikView Desktop product that is run on a machine without a customer or partner license assigned to it. With the QlikView Personal Edition license, everyone is free to create QlikView documents for personal use. If at any point you or your organization decides to acquire a full QlikView license, this Personal Edition installation will automatically become a full QlikView client without requiring any additional software.', 'Features include consolidating relevant data from multiple sources into a single application, exploring the associations in data, enabling social decision making through secure, real-time collaboration.', 'Visualizing data with engaging, state-of-the-art graphics, searching across all data—directly and indirectly, interacting with dynamic apps, dashboards and analytics and accessing, analyzing and capturing data from mobile devices .', 'Qlik is a leader in data discovery delivering intuitive solutions for self-service data visualization and guided analytics. Approximately 34,000 customers rely on Qlik solutions to gain meaning out of information from varied sources, exploring the hidden relationships within data that lead to insights that ignite good ideas. Headquartered in Radnor, Pennsylvania, Qlik has offices around the world with more than 1700 partners covering more than 100 countries.']"
34,https://www.predictiveanalyticstoday.com/google-data-studio/,SAP Crystal Dashboard Design,Google Data Studio,"['Google Data Studio provides easy access to all the data sources for the business to make better decisions. Regardless of whether you’re a business user or a data analyst, and no matter where the data lives, simply access it with a pre-built Data Studio connector.', 'Data Studio handles the authentication, access rights, and structuring of the data. Once a data source is connected, the underlying dimensions and metrics are readily available for use in calculations, transformations, and visualizations.', 'With Data Studio you’ll be able to transform your raw data into the metrics and dimensions needed to create easy-to-follow reports and dashboards. Simple solutions help you cleanse, combine, and transform all your data without writing code or creating SQL queries.', 'Data Studio allows you to leverage the collective wisdom of your entire team with built-in collaboration. Individuals and teams can easily edit, view, add comments, and manage versions of dashboards and reports — both within and outside the walls of your company.', 'No more spreadsheets and emails going back and forth, and no more worrying about managing versions.']"
35,https://www.predictiveanalyticstoday.com/cyfe/,SAP Crystal Dashboard Design,Cyfe,"['Cyfe, is a self-service cloud based business intelligence dashboard app, designed to analyze, transform and report data from different integrated sources of business intelligence. It is a freemium application to track and monitor all business metrics in one single place.', 'Cyfe Dashboard is an online dashboard platform for building real-time business dashboard.Cyfe provides a browser-based dashboard that allows business users to connect to many data services, automate data retrieval, analyze, and then transform and visualize the data for business intelligence. The product targeted non-technical end user by providing them a schema-less architecture to easily connect to data sources, and separates data from presentation and reuse data sources throughout the platform.', 'Cyfe Premium provides customized features and functions that can be used to edit built-in formula, to transform, integrate, and filter any data before visualizing in the front end dashboard.', 'You may like to read: Open Source, Free and Top Dashboard Software and How to Select the Best Dashboard Software for Your Business']"
36,https://www.predictiveanalyticstoday.com/cluvio/,SAP Crystal Dashboard Design,Cluvio,"['Cluvio is a cloud analytics platform for startups and data-driven teams, trusted by over 100 companies. Users can use SQL and R to analyze their data and in a few minutes create beautiful, interactive dashboards for their entire company.', 'There is a wealth of information hiding in the data in the users’ database that is just waiting to be discovered. Daily active users, monthly recurring revenue, signups per day. With Cluvio, users can see the most important KPIs on interactive, real-time dashboards anywhere, anytime.', 'Users can receive alerts for conditions that users define - a sudden drop in number of orders, increased error rates or revenue goals that were reached. Defining and exposing reality based on actual data makes everyone in the company more curious and engaged in the success.', 'Cluvio is very easy to get started with and grows with users’ team. Cluvio is completely free for single users. Users can write SQL, get charts and share dashboards. It doesn’t get easier than this. Cluvio dashboards looks amazing.', 'Cluvio’s usability can’t be measured by normal standards. It is great. Dashboards in Cluvio can be easily made interactive with time based and custom filters. The combined expressiveness of SQL and R makes the Cluvio analysis pipeline extremely powerful.', 'Users can get automatic suggestions for SQL queries and intelligent chart recommendations. Cluvio was designed with pricing that suits any sizes of companies, even cash-strapped startups. With Cluvio pro and business plans, users can invite an unlimited number of business users for free.']"
