,Link,Alternative_for,Name,Description
50,https://www.predictiveanalyticstoday.com/brightpearl/,SAP S/4 HANA,Brightpearl,"['Brightpearl is a platform to manage inventory, accounting, customers, suppliers and fulfillment across your omnichannel business. Paired with real-time reports on inventory, cash flow, profitability across products, channels, customers and much more.', 'The purpose of this software is to help with inventory management, account management, CRM, POS, purchasing and so on. Bright pearl software major features is in full management of inventory, and real-time inventory updates, which helps to prevent double selling, reduces errors and also save team time. it also helps in retail accounting in which the financial position of your business is understood and you can make better decisions on price, channel, purchase and discounts. It feature also include Omnichannel retail, who h is done by consolidating your sales channels, inventory and CRM in a single system. Bright pearl was built to serve any business process.', 'It is ERP for retail which means shorter implementation times and significantly lower total cost of ownership without compromising on retail functionality. it is significantly cheaper that a catch-all ERP system without compromising on the features that retailers really need. By using this product, it will contribute to the growth if your business, contribute to its establishment, provision of wholesale with most mini mal time.', 'This software is cloud-based, easy to use, good connectors and integrations, API and web hooks. Using Bright Pearl will not only make you see your internal order processing but also completely replace the manual effort of updating orders as shipped with tracking references or amending stock levels. With a single Bright Pearl account you can connect to as many eBay stores as you aspire to run.']"
51,https://www.predictiveanalyticstoday.com/netsuite-erp/,SAP S/4 HANA,NetSuite ERP,"['Netsuite is engineered to scale with businesses as they grow and to streamline mission critical processes. It helps in advanced financials, supply chain management, billing and so on.', 'Netsuite ERP gives companies the tools they need to accelerate growth and drive innovation. It features help with financial management through the built-in business intelligence to drive smarterand quicker decision making. It also help in billing management in which there is acciracy, elimination of bill errors, strengthing revenue recognition process and driving fulfillment accuracy and efficiency. Netsuite ERP revenue recognition management helps with accounting standardization, and report financial results in a timely manner.', 'Netsuite ERP financial planning and reporting management helps with initiative planning, budgeting and forecasting solution and decision making respectively. It also help in global accounting and consolidation in which Netsuite provides unprecedental capabilities that increase close time, maxize transparency and ensure compliance.', 'Netsuite ERP Governance, risk and compliance (GRC) solution helps with the issues of corporate governance, enterprise risk management and effective corporate compliance with technology and processes. Order management accelerate the order-to-cash process by sales, finance and fulfillment to pricing, sales order management and return management. It features also include production management, supply chain management, warehouse and fulfillment which helps to manage end-to-end inventory and inbound/outbound logistics in real time while most minimizing the cost of ownership. Netsuite benefits include accuracy, report, timely information and insight, and accelerating the financial close.']"
52,https://www.predictiveanalyticstoday.com/orion-erp/,SAP S/4 HANA,Orion ERP,"['ORION ERP is a fully integrated multi-user, enterprise solution which delivers powerful functionalities through seamless interaction between modules and helps users simultaneously drive growth and sustain competitive advantage in the face of global competition, forces of market consolidation, high stakeholder expectations, talent crunch and compliance mandates and also helps users build agile business processes for now and the future, aligns their business segments to work together to achieve peak performance, and provides users with industry-specific solutions for business insights, operational excellence and innovation.', 'ORION ERP offers features such as financial management, accounts payable, bank reconciliation, fundraising management, CRM, HR and payroll, accounts receivable, fixed assets, accounting management, production support and planning, quality control (QC), lot tracking, sales and marketing, inventory control management, ease of formula creation and maintenance, scalability of formulas based on available inventory levels, accurate and timely forecasts of customer demands , visibility to real-time, enterprise-wide data throughout the supply chain , optimized inventory management and warehouse slotting, tank storage management, compliance with regulated guidelines and programs, quality control and lot tracking defined by users and customers , price, promotional spending, deal discounting, and rebates management and web-enabled activities to increase product awareness.', 'Orion ERP equips companies of all sizes with powerful capabilities to manage enterprise-wide systems, teams, and data which is built to ensure integrated information management and automated operations across the organization for a range of industries and also gives the users complete control over the value chain and instant access to actionable and critical business information.']"
53,https://www.predictiveanalyticstoday.com/kinaxis-rapidresponse/,SAP S/4 HANA,Kinaxis RapidResponse,"['Kinaxis RapidResponse is a supply chain management solution which helps large enterprises with planning, offers organizations the supply chain planning and analytics capabilities they need to manage multiple interconnected supply chain planning processes and connects data, processes, and people in a single environment to assist with operational and financial performance.', 'Kinaxis RapidResponse offers features such as Supply Chain Management, Sales or Operations Planning, Demand Planning, Supply and Capacity Planning, Master Production Scheduling, Order Promising, Inventory Management like shelf-life monitoring, inventory optimization, and collaborative inventory, New Product Integration, Integrated Project Management, Profitability, warehouse management like integrated labeling, storage optimization, and warehouse KPI reports.', 'Kinaxis RapidResponse provides information management integration, inventory analysis, and order processing analysis, internet portal along with inventory availability reporting and status reporting, supplier management features of quality control, supplier invoice auditing, and supplier performance reporting, sales order processing, returns management, user-configurable dashboard, demand forecasting, document management, dynamic route planning engine and freight payment automation.', 'Kinaxis RapidResponse is used by organizations across several industries, including aerospace and defense, automotive, industrial, high-tech (consumer electronics and semiconductors), life sciences and consumer products. Kinaxis RapidResponse lets the user make both long-term and real-time demand and supply balancing decisions quickly, collaboratively, and in line with the shared business objectives of multiple stakeholders.', 'Kinaxis RapidResponse also lets the users model multiple product launch scenarios and apply appropriate risk mitigation strategies and link their project plan milestones to their supply chain. Kinaxis RapidResponse links costing information to “what-if” scenario analysis capabilities which allow managers to immediately calculate the financial impact of demand and supply plan variances, and use profitability considerations as a factor in the options for course correction.']"
54,https://www.predictiveanalyticstoday.com/sisense/,SAP Crystal Reports,Sisense,"['Sisense simplifies business analytics for complex data. Powered by In-Chip and Single Stack technologies Sisense delivers unmatched performance, agility and value, eliminating much of the costly data preparation traditionally needed with business analytics tools and providing a single, complete tool to analyze and visualize large, disparate data sets without IT resources.', 'Sisense’s expertise in complex data includes both large data sets and data derived from multiple, disparate sources. Sisense leverages In-Chip analytics to dramatically improve business users’ access to advanced analytics on low-cost, commodity machines without the need for special data warehouse tools or dedicated IT staff.', 'One-click formulas offer the most popular statistical functions, such as correlation, covariance and various distributions, directly from Sisense dashboards. In-Chip technology processes data 100X faster, thereby eliminating much of the data preparation and denormalization work typically associated with business analytics. There is no need to remodel data schemas or rely on aggregated values.', 'Sisense has built a distinctive integration to R, the popular, open source language for statistical computing. Sisense excels at mashing up multiple data sets and easily making this data available for analysis. By utilizing a combination of Sisense and R, analysts are able to prepare and visualize data results in a fraction of the time that it would take to perform on R alone or with other visualization tools. This integration opens access to R’s robust set of statistical tools and predictive models while leveraging Sisense’s market-leading capabilities in complex data analysis and visualization.']"
55,https://www.predictiveanalyticstoday.com/cluvio/,SAP Crystal Reports,Cluvio,"['Cluvio is a cloud analytics platform for startups and data-driven teams, trusted by over 100 companies. Users can use SQL and R to analyze their data and in a few minutes create beautiful, interactive dashboards for their entire company.', 'There is a wealth of information hiding in the data in the users’ database that is just waiting to be discovered. Daily active users, monthly recurring revenue, signups per day. With Cluvio, users can see the most important KPIs on interactive, real-time dashboards anywhere, anytime.', 'Users can receive alerts for conditions that users define - a sudden drop in number of orders, increased error rates or revenue goals that were reached. Defining and exposing reality based on actual data makes everyone in the company more curious and engaged in the success.', 'Cluvio is very easy to get started with and grows with users’ team. Cluvio is completely free for single users. Users can write SQL, get charts and share dashboards. It doesn’t get easier than this. Cluvio dashboards looks amazing.', 'Cluvio’s usability can’t be measured by normal standards. It is great. Dashboards in Cluvio can be easily made interactive with time based and custom filters. The combined expressiveness of SQL and R makes the Cluvio analysis pipeline extremely powerful.', 'Users can get automatic suggestions for SQL queries and intelligent chart recommendations. Cluvio was designed with pricing that suits any sizes of companies, even cash-strapped startups. With Cluvio pro and business plans, users can invite an unlimited number of business users for free.']"
56,https://www.predictiveanalyticstoday.com/thoughtspot/,SAP Crystal Reports,ThoughtSpot,"['ThoughtSpot offers search-driven analytics for enterprises. The company allows users to search and analyze data, ask questions, get instant charts, analyze company data, build reports, share data, and offers dashboards.', ""It serves communication, retail, financial service, healthcare and life science, and manufacturing sectors. ThoughtSpot's allows for non-technical individuals to conduct a self-service data analysis search. ThoughtSpot's relational search engine can analyze information from any data source, including point of sale data, data warehouses, and social media sites."", 'Search-Driven Analytics allows analyzing data and creating reports and dashboards in seconds. There is no need for SQL expertise or lengthy training sessions - the searches are translated into SQL and answers are calculated on-the-fly.Brand managers can get instant answers about product, customer, and sales data to deliver personalized experiences across every channel.', 'Also, operations managers can maximize efficiency with instant access to store staffing data and hourly order volumes to improve employee productivity.', 'With ThoughtSpot , bank managers get instant answers about transactions, deposits and loan data across each client to identify main customer insights and provide personalized customer experience. ThoughtSpot shows results to traders with immediate access to dozens of sources on securities data to determine accurate price estimates for every trade.', 'DataRank is a machine learning algorithm that sorts and presents data recommendations as users type. It guides users to the right results based on data properties and the collective intelligence in the company, helping people to get answers faster.', ""AutoJoins automatically graphs data sources and joins tables in real-time to calculate answers across previously siloed databases. PopCharts creates instant graphs and charts as users type in ThoughSpot's search box. PopCharts chooses from many new chart types and automatically presents the best one for each search. The results can be saved to a dashboard for future reference."", '']"
57,https://www.predictiveanalyticstoday.com/gooddata/,SAP Crystal Reports,GoodData,"['The GoodData platform includes advanced distribution and product lifecycle management features to automate the process of maintaining one-to-many cloud deployments.', 'GoodData provides a highly engaging guided analytic exploration experience that drives actionable insights by teaching users best practice techniques through recommendations inside the interface.', 'GoodData’s dashboards are responsive, mobile optimized, and include built-in alert, email and collaboration features to promote sharing across the organization', 'GoodData provides groundbreaking BI for data monetization to enterprises, independent software vendors, and system integrators who seek to unlock the value of data for their business networks with engaging, one-to-many analytics.', 'The intelligent analytics distribution platform enables companies like Target, Discovery International and Zendesk to deploy intelligent data products that are guided by GoodData’s expertise in conceptualizing, creating, and delivering widely-adopted analytics solutions.']"
58,https://www.predictiveanalyticstoday.com/datapine-business-intelligence/,SAP Crystal Reports,Datapine Business Intelligence,"['Datapine provides a scalable SaaS, data analysis tool that gives customers fast and easy access to their business intelligence data without the need for any SQL or database knowledge by using an intuitive drag & drop interface to analyze the database. The result is displayed as a chart or as a table and can be used later on for internal and external reporting purposes. Within minutes customers can connect datapine to their existing databases or external interfaces, such as Google Analytics.', 'Datapine enhance dashboards with style elements such as headlines, text boxes and images and provide optional interactive control elements (such as timelines and custom global filters) enable other users to browse and drill-down into your dataset.', 'Datapine provide access to data anytime from PC, tablet or mobile phone and get a real-time overview of business.']"
59,https://www.predictiveanalyticstoday.com/sisense/,SAP Crystal Reports,Sisense,"['Sisense simplifies business analytics for complex data. Powered by In-Chip and Single Stack technologies Sisense delivers unmatched performance, agility and value, eliminating much of the costly data preparation traditionally needed with business analytics tools and providing a single, complete tool to analyze and visualize large, disparate data sets without IT resources.', 'Sisense’s expertise in complex data includes both large data sets and data derived from multiple, disparate sources. Sisense leverages In-Chip analytics to dramatically improve business users’ access to advanced analytics on low-cost, commodity machines without the need for special data warehouse tools or dedicated IT staff.', 'One-click formulas offer the most popular statistical functions, such as correlation, covariance and various distributions, directly from Sisense dashboards. In-Chip technology processes data 100X faster, thereby eliminating much of the data preparation and denormalization work typically associated with business analytics. There is no need to remodel data schemas or rely on aggregated values.', 'Sisense has built a distinctive integration to R, the popular, open source language for statistical computing. Sisense excels at mashing up multiple data sets and easily making this data available for analysis. By utilizing a combination of Sisense and R, analysts are able to prepare and visualize data results in a fraction of the time that it would take to perform on R alone or with other visualization tools. This integration opens access to R’s robust set of statistical tools and predictive models while leveraging Sisense’s market-leading capabilities in complex data analysis and visualization.']"
60,https://www.predictiveanalyticstoday.com/cluvio/,SAP Crystal Reports,Cluvio,"['Cluvio is a cloud analytics platform for startups and data-driven teams, trusted by over 100 companies. Users can use SQL and R to analyze their data and in a few minutes create beautiful, interactive dashboards for their entire company.', 'There is a wealth of information hiding in the data in the users’ database that is just waiting to be discovered. Daily active users, monthly recurring revenue, signups per day. With Cluvio, users can see the most important KPIs on interactive, real-time dashboards anywhere, anytime.', 'Users can receive alerts for conditions that users define - a sudden drop in number of orders, increased error rates or revenue goals that were reached. Defining and exposing reality based on actual data makes everyone in the company more curious and engaged in the success.', 'Cluvio is very easy to get started with and grows with users’ team. Cluvio is completely free for single users. Users can write SQL, get charts and share dashboards. It doesn’t get easier than this. Cluvio dashboards looks amazing.', 'Cluvio’s usability can’t be measured by normal standards. It is great. Dashboards in Cluvio can be easily made interactive with time based and custom filters. The combined expressiveness of SQL and R makes the Cluvio analysis pipeline extremely powerful.', 'Users can get automatic suggestions for SQL queries and intelligent chart recommendations. Cluvio was designed with pricing that suits any sizes of companies, even cash-strapped startups. With Cluvio pro and business plans, users can invite an unlimited number of business users for free.']"
61,https://www.predictiveanalyticstoday.com/thoughtspot/,SAP Crystal Reports,ThoughtSpot,"['ThoughtSpot offers search-driven analytics for enterprises. The company allows users to search and analyze data, ask questions, get instant charts, analyze company data, build reports, share data, and offers dashboards.', ""It serves communication, retail, financial service, healthcare and life science, and manufacturing sectors. ThoughtSpot's allows for non-technical individuals to conduct a self-service data analysis search. ThoughtSpot's relational search engine can analyze information from any data source, including point of sale data, data warehouses, and social media sites."", 'Search-Driven Analytics allows analyzing data and creating reports and dashboards in seconds. There is no need for SQL expertise or lengthy training sessions - the searches are translated into SQL and answers are calculated on-the-fly.Brand managers can get instant answers about product, customer, and sales data to deliver personalized experiences across every channel.', 'Also, operations managers can maximize efficiency with instant access to store staffing data and hourly order volumes to improve employee productivity.', 'With ThoughtSpot , bank managers get instant answers about transactions, deposits and loan data across each client to identify main customer insights and provide personalized customer experience. ThoughtSpot shows results to traders with immediate access to dozens of sources on securities data to determine accurate price estimates for every trade.', 'DataRank is a machine learning algorithm that sorts and presents data recommendations as users type. It guides users to the right results based on data properties and the collective intelligence in the company, helping people to get answers faster.', ""AutoJoins automatically graphs data sources and joins tables in real-time to calculate answers across previously siloed databases. PopCharts creates instant graphs and charts as users type in ThoughSpot's search box. PopCharts chooses from many new chart types and automatically presents the best one for each search. The results can be saved to a dashboard for future reference."", '']"
62,https://www.predictiveanalyticstoday.com/gooddata/,SAP Crystal Reports,GoodData,"['The GoodData platform includes advanced distribution and product lifecycle management features to automate the process of maintaining one-to-many cloud deployments.', 'GoodData provides a highly engaging guided analytic exploration experience that drives actionable insights by teaching users best practice techniques through recommendations inside the interface.', 'GoodData’s dashboards are responsive, mobile optimized, and include built-in alert, email and collaboration features to promote sharing across the organization', 'GoodData provides groundbreaking BI for data monetization to enterprises, independent software vendors, and system integrators who seek to unlock the value of data for their business networks with engaging, one-to-many analytics.', 'The intelligent analytics distribution platform enables companies like Target, Discovery International and Zendesk to deploy intelligent data products that are guided by GoodData’s expertise in conceptualizing, creating, and delivering widely-adopted analytics solutions.']"
63,https://www.predictiveanalyticstoday.com/datapine-business-intelligence/,SAP Crystal Reports,Datapine Business Intelligence,"['Datapine provides a scalable SaaS, data analysis tool that gives customers fast and easy access to their business intelligence data without the need for any SQL or database knowledge by using an intuitive drag & drop interface to analyze the database. The result is displayed as a chart or as a table and can be used later on for internal and external reporting purposes. Within minutes customers can connect datapine to their existing databases or external interfaces, such as Google Analytics.', 'Datapine enhance dashboards with style elements such as headlines, text boxes and images and provide optional interactive control elements (such as timelines and custom global filters) enable other users to browse and drill-down into your dataset.', 'Datapine provide access to data anytime from PC, tablet or mobile phone and get a real-time overview of business.']"
