,Link,Alternative_for,Name,Description
0,https://www.predictiveanalyticstoday.com/sap-business-one/,SAP Business One,SAP Business One,"['SAP Business One Cloud is cloud-based ERP at its best – making it easier and more affordable to manage all your critical business processes. SAP Business One, version for SAP HANA delivers the integrated financial, CRM, and supply chain features you’d expect in an ERP application – supercharged with in-memory technology.', 'SAP Business One analytics powered by SAP HANA helps you drive informed decision making across your company with affordable analytics fueled by our market-leading in-memory platform, SAP HANA.', 'The ERP software offer solutions ranging from accounting to customer relations management. The key features of SAP Business One are accounting management, financial management, customer relationship management, warehouse and production management,purchasing and procurement, reporting, analysis and integration. SAP Business One can be customized to be industry specific to fit the needs of an entity.', 'The system manages consumer products by improving loyalty to customers through customer relationship management, forecasting, inventory control and supplier support and integration. With SAP Business One, one can shrink the supply chain costs, increase the time cycles, minimise wastage and re-work. Production planning and control is enhanced, inventory management and order information. SAP Business One supports professional services especially for consulting firms.', 'Service delivery is enhanced through project planning, resource planning among others. Human resource management which includes recruiting workforce is possible through SAP Business One. SAP Business One supports retail services in delivering personalized shopping experienced to customers. Point of Sale (POS) is activated and offer customers a real-time shopping experience. SAP Business One also features wholesale distribution which ensures timely ordering and processing of orders and invetory.', 'The accounting and financial management functionality enables integration of accounting, sales and purchasing,improving margins and profitability. Customer satisfaction and revenue maximization is enhanced through customer relationship management in SAP Business One. Its support sales and marketing campaigns. The software also helps track inventory movement and improve inventory optimization and minimize stock-outs.', 'SAP Business One utilises Intuitive Business Intelligence (BI) to answer queries, give analysis and reports. SAP HANA is one of the versions of SAP Business One which unlocks valuable business insights making decision making easier. Partners ,subsidiaries can be integrated together and comply with the laws and regulations in which the business operates. One can get a licence for SAP Business One and pay for the number of users required.']"
1,https://www.predictiveanalyticstoday.com/brightpearl/,SAP Business One,Brightpearl,"['Brightpearl is a platform to manage inventory, accounting, customers, suppliers and fulfillment across your omnichannel business. Paired with real-time reports on inventory, cash flow, profitability across products, channels, customers and much more.', 'The purpose of this software is to help with inventory management, account management, CRM, POS, purchasing and so on. Bright pearl software major features is in full management of inventory, and real-time inventory updates, which helps to prevent double selling, reduces errors and also save team time. it also helps in retail accounting in which the financial position of your business is understood and you can make better decisions on price, channel, purchase and discounts. It feature also include Omnichannel retail, who h is done by consolidating your sales channels, inventory and CRM in a single system. Bright pearl was built to serve any business process.', 'It is ERP for retail which means shorter implementation times and significantly lower total cost of ownership without compromising on retail functionality. it is significantly cheaper that a catch-all ERP system without compromising on the features that retailers really need. By using this product, it will contribute to the growth if your business, contribute to its establishment, provision of wholesale with most mini mal time.', 'This software is cloud-based, easy to use, good connectors and integrations, API and web hooks. Using Bright Pearl will not only make you see your internal order processing but also completely replace the manual effort of updating orders as shipped with tracking references or amending stock levels. With a single Bright Pearl account you can connect to as many eBay stores as you aspire to run.']"
2,https://www.predictiveanalyticstoday.com/netsuite-erp/,SAP Business One,NetSuite ERP,"['Netsuite is engineered to scale with businesses as they grow and to streamline mission critical processes. It helps in advanced financials, supply chain management, billing and so on.', 'Netsuite ERP gives companies the tools they need to accelerate growth and drive innovation. It features help with financial management through the built-in business intelligence to drive smarterand quicker decision making. It also help in billing management in which there is acciracy, elimination of bill errors, strengthing revenue recognition process and driving fulfillment accuracy and efficiency. Netsuite ERP revenue recognition management helps with accounting standardization, and report financial results in a timely manner.', 'Netsuite ERP financial planning and reporting management helps with initiative planning, budgeting and forecasting solution and decision making respectively. It also help in global accounting and consolidation in which Netsuite provides unprecedental capabilities that increase close time, maxize transparency and ensure compliance.', 'Netsuite ERP Governance, risk and compliance (GRC) solution helps with the issues of corporate governance, enterprise risk management and effective corporate compliance with technology and processes. Order management accelerate the order-to-cash process by sales, finance and fulfillment to pricing, sales order management and return management. It features also include production management, supply chain management, warehouse and fulfillment which helps to manage end-to-end inventory and inbound/outbound logistics in real time while most minimizing the cost of ownership. Netsuite benefits include accuracy, report, timely information and insight, and accelerating the financial close.']"
3,https://www.predictiveanalyticstoday.com/orion-erp/,SAP Business One,Orion ERP,"['ORION ERP is a fully integrated multi-user, enterprise solution which delivers powerful functionalities through seamless interaction between modules and helps users simultaneously drive growth and sustain competitive advantage in the face of global competition, forces of market consolidation, high stakeholder expectations, talent crunch and compliance mandates and also helps users build agile business processes for now and the future, aligns their business segments to work together to achieve peak performance, and provides users with industry-specific solutions for business insights, operational excellence and innovation.', 'ORION ERP offers features such as financial management, accounts payable, bank reconciliation, fundraising management, CRM, HR and payroll, accounts receivable, fixed assets, accounting management, production support and planning, quality control (QC), lot tracking, sales and marketing, inventory control management, ease of formula creation and maintenance, scalability of formulas based on available inventory levels, accurate and timely forecasts of customer demands , visibility to real-time, enterprise-wide data throughout the supply chain , optimized inventory management and warehouse slotting, tank storage management, compliance with regulated guidelines and programs, quality control and lot tracking defined by users and customers , price, promotional spending, deal discounting, and rebates management and web-enabled activities to increase product awareness.', 'Orion ERP equips companies of all sizes with powerful capabilities to manage enterprise-wide systems, teams, and data which is built to ensure integrated information management and automated operations across the organization for a range of industries and also gives the users complete control over the value chain and instant access to actionable and critical business information.']"
4,https://www.predictiveanalyticstoday.com/kinaxis-rapidresponse/,SAP Business One,Kinaxis RapidResponse,"['Kinaxis RapidResponse is a supply chain management solution which helps large enterprises with planning, offers organizations the supply chain planning and analytics capabilities they need to manage multiple interconnected supply chain planning processes and connects data, processes, and people in a single environment to assist with operational and financial performance.', 'Kinaxis RapidResponse offers features such as Supply Chain Management, Sales or Operations Planning, Demand Planning, Supply and Capacity Planning, Master Production Scheduling, Order Promising, Inventory Management like shelf-life monitoring, inventory optimization, and collaborative inventory, New Product Integration, Integrated Project Management, Profitability, warehouse management like integrated labeling, storage optimization, and warehouse KPI reports.', 'Kinaxis RapidResponse provides information management integration, inventory analysis, and order processing analysis, internet portal along with inventory availability reporting and status reporting, supplier management features of quality control, supplier invoice auditing, and supplier performance reporting, sales order processing, returns management, user-configurable dashboard, demand forecasting, document management, dynamic route planning engine and freight payment automation.', 'Kinaxis RapidResponse is used by organizations across several industries, including aerospace and defense, automotive, industrial, high-tech (consumer electronics and semiconductors), life sciences and consumer products. Kinaxis RapidResponse lets the user make both long-term and real-time demand and supply balancing decisions quickly, collaboratively, and in line with the shared business objectives of multiple stakeholders.', 'Kinaxis RapidResponse also lets the users model multiple product launch scenarios and apply appropriate risk mitigation strategies and link their project plan milestones to their supply chain. Kinaxis RapidResponse links costing information to “what-if” scenario analysis capabilities which allow managers to immediately calculate the financial impact of demand and supply plan variances, and use profitability considerations as a factor in the options for course correction.']"
5,https://www.predictiveanalyticstoday.com/spendmap-free/,SAP Ariba Procure to Pay,SpendMap Free,"['SpendMap, develop e-procurement software systems to help organizations simplify their Purchasing processes and better control spending. SpendMap automates things like requisitions and approvals, purchase orders, expense reports, supplier invoice approval and inventory control.', 'SpendMap’s Free-Procurement Project brings the benefits of Purchase Order Software and e-Procurement to small businesses and small buying groups in larger organizations. SpendMap is modular and easily expandable, so you can automate just your Purchase Orders if that’s all you need or you can add optional modules at any time to streamline more of your procurement process, from initial requisition all the way through to supplier invoice approval and inventory control.', 'SpendMap increases control in your purchasing department by stopping unwanted spending before it occurs rather than cleaning up messes after the fact. SpendMap empowers its clients to implement spend management best practices to manage spending with a high level of visibility, predictability and control.', 'Let SpendMap help you confirm available funds and update budgets weeks before the invoice hits your General Ledger. Use it to enforce the use of only authorized vendors, items and account codes throughout all stages of the procurement process and create detailed audit trails of historical events that can be used to further enhance procurement policies and lower overall prices for the goods and services that are needed to keep your business running smoothly. SpendMap was used to eliminate paper-based, manual processes and gain control of ACI’s spending, resulting in bottom-line savings. SpendMap allows companies to track, manage and secure the purchasing process in a way that provides control and visibility.']"
6,https://www.predictiveanalyticstoday.com/sap-ariba-start-sourcing/,SAP Ariba Procure to Pay,SAP Ariba Start Sourcing,"['Leading companies and analysts view strategic sourcing as a key to holding down costs and improving savings. And the SAP Ariba Start Sourcing solution, powered and supported by FreeMarkets, the online marketplace that started it all, is the most effective solution in the market for driving it.', 'Leveraging FreeMarkets technology and services, SAP Ariba Start Sourcing allows companies to overcome the challenges of sourcing in volatile global markets. A unique software-as-a-service (SaaS) solution, SAP Ariba Start Sourcing gives small businesses and midsize companies access to enterprise-class technology they can use to structure and execute sourcing events online that deliver real, measurable results without a substantial commitment of time or resources.', 'SAP Ariba Start Sourcing delivers more frequent innovation to help ensure speed, consistency, and repeatability, and is proven to deliver tangible, bottom-line value for organizations of all sizes and industries. Suppliers are motivated by competition to keep their profiles current, so you can spend your time more productively.', 'Drive events from your configurable dashboard and stay informed about status, tasks, responses, and more with ready-made, exportable reports. Information is normalized to your preferences when suppliers bid in their native language and currency. SAP Ariba Start Sourcing customers have experienced average purchase price reductions of 8 percent to 14 percent in projects that run less than six weeks, from start to finish.', 'Your SAP Ariba Start Sourcing solution is upgraded automatically at no charge whenever we issue major product releases and service packs. With SAP Ariba, you get the broadest set of capabilities on the market. Like market-leading innovations in guided buying and spot buy. Plus, the most pre-enabled suppliers, easy supplier and catalog enablement, and integration with Ariba Network.', 'You may like to read: Top Free & Premium Procurement Software and How to Select the Best Procurement Software for Your Business']"
7,https://www.predictiveanalyticstoday.com/microsoft-project/,SAP Portfolio and Project Management,Microsoft Project & PPM,"['Microsoft Project & Portfolio Management (PPM) helps the users get started quickly and execute projects with ease. With its built-in templates, familiar scheduling tools, and access across devices, users can increase productivity for project managers and teams. Users can also streamline project, resource, and portfolio management with Microsoft Project & Portfolio Management (PPM). Its integrated planning tools help the users keep track of projects and stay organized. Microsoft PPM helps the users get started quickly and execute projects with ease.', 'Microsoft Project’s built-in templates are customizable which uses industry best practices to help the users get started on the right path so there’s no need to create project plans from scratch. Microsoft Project’ familiar scheduling features like Gantt charts and prepopulated pulldown menus help reduce training time and simplify the project planning process.', 'Microsoft Project lets users share reports across their organization to keep everyone on the same page. Microsoft Project’s reports include everything from burndown charts to financials; and are available across devices. Microsoft Project also lets users quickly view all project activities, from tasks to upcoming milestones where the users can customize timelines to represent specific data and easily share them with project stakeholders.', 'Microsoft PPM is available on Windows, iOS®, and Android™ devices, so team members can update tasks on their device of choice and view timelines and reports on the go. Users can now easily plan, track status, and collaborate with others from virtually anywhere using the Project Online Professional which keeps users’ projects, resources, and teams organized and on track.']"
8,https://www.predictiveanalyticstoday.com/celoxis/,SAP Portfolio and Project Management,Celoxis,"['Celoxis advanced features address the real-world complexities of managing projects across organizations and functions; it excels at planning, delegation, collaboration, tracking and reporting with great agility and user-friendliness. Celoxis allows the user to maximize the user’s project and portfolio management software investment. Celoxis offers features such as Advanced Scheduling, Gantt, Project Tracking, Resource Management, Time & Expense Management, Financial Management, Project Portfolio Management, Risk Management, Reporting and Analysis, Collaboration, Bug/Issue Tracking, Custom Fields, Security and 24x5 Support.', ""Celoxis' comprehensive features address the real-world complexities of managing projects across organizations and functions; it excels at planning, delegation, collaboration, tracking and reporting with great agility and user-friendliness. Celoxis help users plan and manage real-world, diverse project portfolios. It is highly customizable to suit a variety of business needs."", 'Celoxis offers a choice of cloud-based or on-premise deployment. The solution is fully customizable and offers seamless integrations with over 400 business applications.', 'Celoxis is one of the most comprehensive yet very affordable project management software in the marketplace.', 'Celoxis comes with a full-featured 30-day trial access to allow businesses to not just kick the tyres but also to use realistic project scenarios to run through your list of business challenges and software requirements. You get access to the best support resources including their 24x5 unmatched customer support. The help center is packed with easy to use self-help resources such as getting started guides, product FAQs and How-Tos, short explainer videos, product documentation manual and community forums.', 'Celoxis also offers various onboarding packages and instructor-led training modules to help new customers accelerate Celoxis adoption and time to value.']"
9,https://www.predictiveanalyticstoday.com/sap-portfolio-project-management/,SAP Portfolio and Project Management,SAP Portfolio and Project Management,"['SAP Portfolio and Project Management is an efficient project portfolio management (PPM), complete quality work on schedule and within budget which gives the user robust tools to centrally manage the full project lifecycle, from forecasting and planning to tracking and accounting and can help the user invest the right resources in the right projects and align strategy with business objectives.', 'SAP Portfolio and Project Management offers capabilities such as Portfolio management, Project management, Resource management and Portfolio project tracking and simulation.', 'SAP Portfolio and Project Management lets the user align initiatives with strategic goals to demonstrate and increase their value, balance the user’s portfolio based on risk, business objectives, and investment type, identify project anomalies and risks, and make midcourse adjustments, better allocate resources by capturing, prioritizing, and matching demand to available supply, streamline and enforce approvals for funding, resources, gate decisions, and ongoing evaluations and lower TCO with pre-built, services-based integration to disparate back-end systems.', 'SAP Portfolio and Project Management effectively manages project operations across the user’s company with tools for structuring, scheduling and visualization. SAP Portfolio and Project Management supports different implementation and management models, such as Six Sigma, Phase-Gate, critical-path, product and cycle-time excellence (PACE). SAP Portfolio and Project Management lets the user incorporate all HR and financial resources, either within resource pools or enterprise-wide.', 'SAP Portfolio and Project Management enables the user to deploy resources efficiently and assign them to projects based on need, qualifications, and availability. SAP Portfolio and Project Management also manages upcoming resource demand with information about effort, location, skill, and source requirements.', 'You may also like to read: Top Project Portfolio Management (PPM) Software and How to Select the Best Project Portfolio Management (PPM) Software for Your Business']"
10,https://www.predictiveanalyticstoday.com/hp-ppm/,SAP Portfolio and Project Management,HP PPM,"[""HP PPM software provides the real-time information needed to standardize, manage, and record projects. Today's project management organization (PMO) struggles with time, cost, and resource management challenges, particularly visibility and data consolidation within the enterprise portfolio. Given these daily challenges, it is difficult for executives to see which projects and operational activities they should be working on to find out how much is left in their budget, to what capacity are resources being utilized, and how to align activities with business demands."", ""HPE's innovative PPM solution helps executives overcome all challenges by providing critical information in real-time to help PMO makes the right investment decisions by standardizing, managing, and capturing the execution of a project and operational activities and resources. PPM's related products and services include ALM Software, Agile Manager, Enterprise Maps, IT Business Analytics, IT Service Management Services, and Software support."", 'ALM Software helps a company to master the modern, agile application lifecycle, the Agile Manager is a SaaS-based agile project management software for organizing, planning and executing agile projects, and the Enterprise Maps enables an organization to gain transparency of the IT landscape to drive transformation and deliver business outcomes.', ""IT Business Analytics provides informed management of IT process performance while the IT Service Management Services offers a Comprehensive IT and business services to propel an enterprise forward. Software support assists a company in meeting its IT challenges with industry-leading service and support. With PPM, a company can engage with PPM's application lifecycle management through the ALM community, ALM on HPLN, ALM on Twitter, HPE Software on LinkedIn and more.""]"
11,https://www.predictiveanalyticstoday.com/dassault-systemes-3dexperience/,SAP Portfolio and Project Management,Dassault Systèmes 3DEXPERIENCE,"['Dassault Systèmes 3DEXPERIENCE is a business experience platform that provides software solutions for every organization in a company from marketing to sales to engineering that help firms, in their value creation process, to create differentiating consumer experiences.', 'With a single, easy-to-use interface, it powers Industry Solution Experiences based on 3D design, analysis, simulation, and intelligence software in a collaborative, interactive environment. It is available on-premise and in the cloud. 3DEXPERIENCE platform on the cloud offers simplicity, delivering a transparent all-in-one service on the Cloud with an immediate and common access to the largest portfolio of applications. The 3DEXPERIENCE platform all-inclusive service package offers Saas, PaaS, IaaS, maintenance, back-ups, automatic upgrades and support 24*7.', 'Dassault Systèmes offers industry-leading applications delivered on the3DEXPERIENCE platform: Design & Engineering, Manufacturing & Production, Simulation, Governance & Lifecycle, 3D Design Experience for Professionals, Dashboard intelligence as well as a broad catalog of services. Thus, 3DEXPERIENCE enables maximum flexibility and optimal total cost of ownership. 3DEXPERIENCE Application Engineering provides roles for users by industry application and for designers and engineers to utilize simulation throughout their daily product design activities.', 'Simulation technology covers structures, fluids, plastic injection molding, acoustics, and structural applications. 3DEXPERIENCE also delivers quality and compliance through ENOVIA Quality Management to enforce common quality processes, support global and local regulatory requirements and manage all quality event, and Enovia Compliance Management helps ensure proper product approvals and certificates in support of business sustainability as well as product safety and effectiveness. 3DEXPERIENCE also offers product planning and program management among other roles it performs.']"
